{
  "schema_version": "hermes.ai_business_os.role_manifest.v1",
  "manifest_version": 1,
  "role": "cpo",
  "title": "Chief Product Officer",
  "purpose": "Owns roadmap, requirements, product trade-offs, and customer impact.",
  "toolsets": [
    "kanban",
    "file"
  ],
  "skills": [],
  "rights": {
    "scope": "product direction",
    "asset_policy": "internal-only",
    "publish": false
  },
  "freshness": {
    "reviewed_at": "2026-08-20",
    "max_age_days": 30
  },
  "license": "MIT"
}
