{
  "schema_version": "hermes.ai_business_os.role_manifest.v1",
  "manifest_version": 1,
  "role": "cco",
  "title": "Chief Communications Officer",
  "purpose": "Owns executive communications, customer messaging, and external narrative.",
  "toolsets": [
    "kanban",
    "file"
  ],
  "skills": [],
  "rights": {
    "scope": "communications and narrative",
    "asset_policy": "internal-only",
    "publish": false
  },
  "freshness": {
    "reviewed_at": "2026-08-20",
    "max_age_days": 30
  },
  "license": "MIT"
}
