{
  "schema_version": "hermes.ai_business_os.role_manifest.v1",
  "manifest_version": 1,
  "role": "gc",
  "title": "General Counsel",
  "purpose": "Owns legal review, contract posture, and compliance constraints.",
  "toolsets": [
    "kanban",
    "file"
  ],
  "skills": [],
  "rights": {
    "scope": "legal review",
    "asset_policy": "internal-only",
    "publish": false
  },
  "freshness": {
    "reviewed_at": "2026-08-20",
    "max_age_days": 30
  },
  "license": "MIT"
}
